{
  "name": "_APP_NAME_",
  "type": "AIflow:app",
  "version": "0.0.1",
  "description": "My AIflow application description",
  "appModel": "1.0.0",
  "imports": [
    "github.com/r2d2-ai/ai-box/contrib/activity/log",
    "github.com/r2d2-ai/ai-box/contrib/trigger/rest",
    "github.com/r2d2-ai/ai-box/flow"
  ],
  "triggers": [
    {
      "id": "my_rest_trigger",
      "ref": "#rest",
      "settings": {
        "port": "8888"
      },
      "handlers": [
        {
          "settings": {
            "method": "GET",
            "path": "/test/:val"
          },
          "actions": [
            {
              "ref": "#flow",
              "settings": {
                "flowURI": "res://flow:simple_flow"
              },
              "input": {
                "in": "=$.pathParams.val"
              }
	    }
	  ]
        }
      ]
    }
  ],
  "resources": [
    {
      "id": "flow:simple_flow",
      "data": {
        "name": "simple_flow",
        "metadata": {
          "input": [
            { "name": "in", "type": "string",  "value": "test" }
          ],
          "output": [
            { "name": "out", "type": "string" }
          ]
        },
        "tasks": [
          {
            "id": "log",
            "name": "Log Message",
            "activity": {
              "ref": "#log",
              "input": {
                "message": "=$flow.in",
                "addDetails": "false"
              }
            }
          }
        ],
        "links": []
      }
    }
  ]
}
